Text,Language
"Per usi commerciali, l'apprendimento automatico è conosciuto come analisi predittiva.",Italian
"Como consecuencia, y tras la labor realizada a través de una iniciativa de la Fundación Wikimedia junto a miles de voluntarios para modificar la interfaz de la enciclopedia, el dibujo de la globo-rompecabezas fue reemplazado en 2010 por un modelo tridimensional, en el que algunos símbolos de las piezas de rompecabezas fueron reemplazados por otros, principalmente aquellos que constituyen el primer grafema de la palabra ""Wikipedia"" en distintas wikipedias que existen en el mundo.",Spanish
"Foi esclarecido que esta política não está em debate, mas ela tem-se revelado controversa.",Portuguese
"En juillet 2007, Wikipédia a fait l'objet d'un documentaire de 30 minutes sur la BBC Radio 4[100], qui affirmait que « Wikipédia » était devenu un terme connu par tout le monde, au même titre que « Google », « Facebook » et « YouTube ».",French
oh idiot il est riche et beau que demander de plus Terrence J'accepte ta proposition.,French
"Connaissant ces règles, l'homme peut alors se rendre « comme maître et possesseur de la nature » (Descartes).",French
"com sua única filha, narcisa marion era extremamente humilde e doce narcisa, porém era completamente o oposto, você vê que ela era linda além das palavras, ela era como uma vida.",Portuguese
hey perché non esci con noi puoi dire loro che mi dispiace ma sono sommerso dal lavoro o sono sommerso alcune altre parole che puoi usare al posto di sommerso se ho troppo fare.,Italian
"L'obiettivo principe dell'apprendimento automatico è che una macchina sia in grado di generalizzare dalla propria esperienza[18], ossia che sia in grado di svolgere ragionamenti induttivi.",Italian
"Contrairement aux algorithmes classiques (qui suivent un ensemble de règles prédéterminées), l’apprentissage automatique apprend ses propres règles[28].",French
"Jeg elsker at du solgte mig, fordi folk nogle gange beskriver deres rejse eller nogen de købte, og de beskriver det er så godt.",Danish
just think of that poor narcissus mother was so worried about her daughter and how.,English
"[11] The project's reputation improved further in the 2010s as it increased efforts to improve its quality and reliability, based on its unique structure, curation and absence of commercial bias.",English
Jag har tappat min telefon och jag är i en fix eller vår buss gick sönder i morse och jag är i en fix som min vän alltid vänder sig till mig för hjälp när han är i fix och när det går bra han glömmer bort.,Swedish
Las redes de neuronas artificiales (RNA) son un paradigma de aprendizaje automático inspirado en las neuronas de los sistemas nerviosos de los animales.,Spanish
"Maher stated regarding the harassment issue that: ""It establishes a sense within the community that this is a priority ... (and that correction requires that) it has to be more than words.",English
but was heartbroken for everything there was inedible she soon started to cry i don't want this but the food is really good.,English
"An ANN is a model based on a collection of connected units or nodes called ""artificial neurons"", which loosely model the neurons in a biological brain.",English
About 47 percent of Wikipedia readers do not realize that Wikipedia is a non-profit organization.,English
"Les vandalismes les plus évidents (écrasements de pages entières, messages d'insulte, graffiti) sont généralement détectés à ce stade, et corrigés dans les secondes ou minutes qui suivent par un retour à la version précédente.",French
"Según Jimmy Wales, uno de los fundadores de Wikipedia, la colaboración produce efectos positivos y ampliamente aceptados.",Spanish
"não posso te ajudar aí, desculpe.",Portuguese
evitando uma pergunta.,Portuguese
"e sai la parte migliore è stata quando ero nel mio abito da sposa che era anche d'oro, ovviamente tutti fissavano solo me narcisa, non c'è niente di straordinario in quel sogno.",Italian
helaas moet ik nee zeggen.,Dutch
"Ces erreurs peuvent rester des mois voire des années dans l'article, et restent d'autant plus longtemps que l'article est peu lu et peu modifié[63].",French
"ça coule, dis-tu, ressaisis-toi comme littéralement prends-toi et ressaisis-toi, arrête de travailler hey calmez-vous ensemble une autre phrase que.",French
"""[324] Wikipedia won two major awards in May 2004.",English
"eu sou terrence o anjo da boa fortuna o nome e a beleza da sua filha são conhecidos em todo o mundo aqui eu trouxe um presente para você, mas você mal o conhece, você não pode ir com ele.",Portuguese
wat gebeurt er als je iets niet hebt opgevangen of als het de persoon die je altijd kunt vragen niet begreep of ik je goed heb begrepen ?.,Dutch
"åh fjollet han er rig og smuk, hvad mere kan jeg ønske mig forfærdelse, jeg accepterer dit forslag.",Danish
i'm afraid i can't.,English
"muñeca y la parte más divertida es que ella se amaba a sí misma sin fin, narcisa, ¿verdad?",Spanish
"Ya en los primeros días de la IA como disciplina académica, algunos investigadores se interesaron en hacer que las máquinas aprendiesen.",Spanish
"Sanger coined its name[5][6] as a portmanteau of ""wiki"" and ""encyclopedia"".",English
seguro que sigue.,Spanish
"Dans un communiqué de presse du 10 novembre 2009, Wikimedia Foundation annonce recevoir plus de 320 millions de visiteurs par mois pour Wikipédia et ses projets frères, d'après comScore Media Metrix[104].",French
"[43] In July 2012, The Atlantic reported that the number of administrators is also in decline.",English
"quando ele espirrou oh oh e a última parada não, não quero ouvir mais nada, tudo que pude ver foi que aqueles homens eram realmente legais, minha querida, você deve conhecer essa beleza.",Portuguese
"Aristote énumère cependant plusieurs définitions différentes de la nature, et introduit une opposition entre le naturel et l'artificiel : le naturel est ce qui est produit par la phusis, ce qui existe par soi-même, l'artificiel est ce qui est produit par la technè, par l'action et le travail (d'Hommes, d'animaux ou de dieux).",French
"""[327] In September 2008, Wikipedia received Quadriga A Mission of Enlightenment award of Werkstatt Deutschland along with Boris Tadić, Eckart Höfling, and Peter Gabriel.",English
"There are a number of such regions, ranging from the tropical climate at the equator to the polar climate in the northern and southern extremes.",English
questa è una bella domanda.,Italian
Je suis désolé.,French
"Si eso es realmente lo que quieres, te llevaré a casa.",Spanish
"in Francia il rendezvous precedente era usato dall'esercito per indicare un luogo di incontro per le truppe, ora c'è qualcosa di leggermente eccitante e segreto nella parola rendezvous anche adesso, quindi puoi usare rendezvous per qualsiasi riunione.",Italian
scusandosi.,Italian
"[7] Precipitation varies widely with location, from several metres of water per year to less than a millimetre.",English
"[13] O Pew Research Center e o projeto ""American Life"" constatou que um terço dos usuários da Internet dos Estados Unidos consultam a Wikipédia.",Portuguese
An artificial neuron that receives a signal can process it and then signal additional artificial neurons connected to it.,English
"Im Energiebeispiel macht mich ein schweres Mittagessen sehr nachmittags träge, hat Wurzeln aus dem Wort, was bedeutet, dass eine langsame Person und eine Schnecke ein Tier ist, das sich wirklich sehr langsam bewegt wie ein Schneckenbeispiel.",German
[3]​ Para la mayoría de los científicos publicar en Nature constituye una marca de prestigio.,Spanish
"""[114] This method of evaluating contributions was later disputed by Aaron Swartz, who noted that several articles he sampled had large portions of their content (measured by number of characters) contributed by users with low edit counts.",English
"och de är som att jag vill köpa samma sak och jag säger till dem att du sålde det att du sålde mig, jag skulle inte köpa det här, du sålde mig om du inte är intresserad av konversationen.",Swedish
"El principal culpable de esta bajada es el buscador de Google, que entre sus muchas funciones y herramientas, muestra a menudo extractos de Wikipedia cuando se hace una búsqueda y suele dar prioridad a los vídeos de YouTube, plataforma de su propiedad.",Spanish
klinkt goed.,Dutch
"Sus más de 50 millones de artículos en 300 idiomas han sido redactados en conjunto por voluntarios de todo el mundo,[5]​ lo que suma más de 2000 millones de ediciones, y permite que cualquier persona pueda sumarse al proyecto[6]​ para editarlos, a menos que la página se encuentre protegida contra vandalismos para evitar problemas o disputas.",Spanish
"1,14% var från Sverige.",Swedish
kom nu.,Danish
La première grande philosophie de la nature se trouve dans l'œuvre d'Aristote.,French
"Ich habe so viel über dich gehört Ich hole dir etwas zu essen, oh danke, sie gingen ins Esszimmer und dort auf dem Tisch war das erstaunlichste Essen, das Narcisa jemals erstaunlich gesehen hatte, weil es die Marmeladen sind, die gemacht wurden.",German
"Une étude de 2020[1] suggère qu'il existe actuellement quatre sens principaux au terme « nature », irréductibles les uns aux autres : La notion de nature porte donc en elle des questions philosophiques, à travers les rapports que l'homme entretient avec le milieu naturel et l'environnement, ses conceptions de la vie sociale, et les multiples sens qu'il est possible d'attribuer au mot nature dans les représentations sociales.",French
"è acceso, il che significa che è incredibile che molti americani abbiano detto in California.",Italian
"Es war eine Freude, Sie später zu sehen.",German
"også, hvis du kunne lide denne video, skal du give tommelfingrene op ved at trykke på lignende-knappen og huske at abonnere på denne kanal ved at klikke på knappen abonner for at få mine seneste lektioner lige her på youtube.",Danish
hey guys welcome to my channel in this video.,English
lad mig tænke et øjeblik.,Danish
"und damit stieg sie in seinen Wagen und ohne sich von ihrer Mutter zu verabschieden, ritt sie mit dem Engel davon, als sie unterwegs waren.",German
"The biosphere is the part of Earth's outer shell—including land, surface rocks, water, air and the atmosphere—within which life occurs, and which biotic processes in turn alter or transform.",English
"zin nummer twee als je iemand een tijdje niet hebt gezien, vertel je hem een ​​lange tijd niet gezien, dus dat betekent dat je deze persoon misschien weken of maanden niet gezien hebt, zin nummer.",Dutch
Wikipedia y Nupedia coexistieron hasta la extinción de la segunda en 2003.,Spanish
"[4] Wikipedia ejes og drives af Wikimedia Foundation, en almennyttig organisation der drives ved hjælp af donationer for at kunne være uafhængig.",Danish
"En enero de 2011, Wikipedia contenía 278 ediciones —268 activas— en varios estados de desarrollo, que sumaban más de 17 millones de artículos.",Spanish
"[197]​ Ndesanjo Macha indica que muchas veces lo más enriquecedor está en las discusiones y no en el artículo propiamente dicho, porque allí pueden reflejarse mejor los distintos puntos de vista y las lagunas existentes.",Spanish
"Von Rubinen sind die Salate von Smaragden und das Brot dort drüben aus goldgoldenem Brot, wie schön diese Marmelade mit dem Brot aussehen und schmecken wird, mit dem sie eine Scheibe genommen hat.",German
"en zei dat hij met me wilde trouwen, hij was in een gouden koets gekomen en hij was van boven tot onder gekleed en ook goud wat een dwaze droom.",Dutch
hello and welcome.,English
hvad med at have pizza til middag i aften?,Danish
"Em 26 de janeiro de 2007, a Wikipédia também foi premiada com a classificação de quarta melhor marca pelos leitores do brandchannel.com, recebendo 15% dos votos, em resposta à pergunta ""Qual marca teve mais impacto em nossas vidas em 2006?",Portuguese
Different layers may perform different kinds of transformations on their inputs.,English
"[217] One privacy concern in the case of Wikipedia is the right of a private citizen to remain a ""private citizen"" rather than a ""public figure"" in the eyes of the law.",English
"Durant les années suivantes, les applications de l'apprentissage automatique médiatisées se succèdent bien plus rapidement qu'auparavant.",French
"De software, MediaWiki, is opensourcesoftware die ook gebruikt wordt door de andere projecten van de Wikimedia Foundation en door talloze andere projecten en bedrijven.",Dutch
"[78] A Wikipédia publica ""dumps"" de seu conteúdo, mas estes consistem apenas de texto; em 2007 não havia dumps disponíveis de imagens da Wikipédia.",Portuguese
Warte einen Moment.,German
i den här videon kommer jag att ge dig 100 vanliga och mycket användbara meningar som du kan använda i samtal.,Swedish
Jag älskar att du sålde mig eftersom ibland människor beskriver sin resa eller någon de köpte och de beskriver att det är så bra.,Swedish
Celui-ci occupa à partir du XIXe siècle une place beaucoup plus importante.,French
"[207] O artigo sobre ""Virgin Killer"", um álbum de 1976 da banda alemã de heavy metal Scorpions, apresenta uma imagem da capa original do álbum, que retrata uma menina pré-adolescente nua.",Portuguese
Narcisa war jedoch genau das Gegenteil.,German
"og fortsæt derefter med at forklare, hvor du har, fik jeg dig ret ?.",Danish
"""[320] An October 2007 Reuters article, titled ""Wikipedia page the latest status symbol"", reported the recent phenomenon of how having a Wikipedia article vindicates one's notability.",English
Cómo' s narcisismo ahora marian les contó a ambos todo lo que había pasado y ella ha cambiado mucho desde ese momento.,Spanish
Ces modifications sont identifiées par l'adresse IP du rédacteur ou par son pseudonyme s'il s'est préalablement identifié[38].,French
"La conclusión fue que la Wikipedia en inglés mostraba que los artículos realizados por mujeres, presumiblemente destinados más a un público femenino, eran significativamente más cortos que los redactados por hombres o por hombres y mujeres.",Spanish
Central to the ecosystem concept is the idea that living organisms interact with every other element in their local environment.,English
och du vet att den bästa delen av det var när jag var i min bröllopsklänning som var av guld också såklart alla stirrade bara på mig narcisa det finns inget fantastiskt med den drömmen.,Swedish
"[12][a] Svenskspråkiga Wikipedia innefattar emellertid en stor andel (3,1 miljoner eller 81 procent, noterat januari 2019[14]) robotskapade artiklar och var i september 2020 bara på fjortonde plats sett till antal redigeringar sedan start och på tjugonde plats sett till antal aktiva inloggade bidragsgivare under senaste månaden.",Swedish
"[250][needs update] As of 2019[update], page requests are first passed to a front-end layer of Varnish caching servers.",English
[153] As solicitações de página são servidas por uma camada de servidores de cache Squid.,Portuguese
"Es ist, als wäre es egal.",German
det finns inget utrymme för tvivel i Amerika om du vill sms någon eller skicka dem ett meddelande du säger text till text så jag smsar dig betyder att jag kommer att skicka ett meddelande via whatsapp eller ett telegram eller messenger av vad som helst jag använder sms till dig igen för att muntra upp någon för att berätta för dem att inte vara upprörda du kan säga att det inte är värt det som varför gråter du?,Swedish
"sì, per favore assicurati, vai avanti.",Italian
La rivista scientifica Nature nel 2005 riportava (anche in risposta al caso Seigenthaler) i risultati di uno studio comparato secondo cui le voci scientifiche in Wikipedia erano comparabili in accuratezza a quelle presenti nell'Enciclopedia Britannica (sull'edizione inglese di Wikipedia furono riscontrati una media di 4 errori per voce contro i 3 della Britannica).,Italian
and said that he wanted to marry me he had come in a golden carriage and he was dressed from top to bottom and gold as well what a silly dream.,English
"Medelåldern bland författarna var 26,8 år, och bland läsarna 25,3 år.",Swedish
"[133] Though the various language editions are held to global policies such as ""neutral point of view"", they diverge on some points of policy and practice, most notably on whether images that are not licensed freely may be used under a claim of fair use.",English
"blev klar til seng mor, jeg håber virkelig min drøm går i opfyldelse, du ved åh narcisa den næste dag, da narcisa og hendes mor var udenfor i deres have en smuk.",Danish
déjame pensar por un momento.,Spanish
non posso ringraziarti abbastanza.,Italian
"El 20 de septiembre de 2004, Wikipedia alcanzó 1 millón de artículos en 100 idiomas.",Spanish
Sie sind gut für dich.,German
"Mais especificamente, o tribunal ordenou que a URL no domínio alemão.de (http://www.wikipedia.de/) não poderia redirecionar para servidores da enciclopédia na Flórida, em http://de.wikipedia.org, embora os leitores alemães ainda permanecessem capazes de usar a URL baseada nos EUA diretamente, e não houve praticamente nenhuma perda de acesso por parte deles.",Portuguese
Terry in realtà assomigli un po 'a quell'angelo anche se cosa sto vedendo come potresti essere lui voi due siete così gentili,Italian
Por ejemplo no se podrán clasificar todos aquellas entradas de las que no se haya recibido ninguna información en la fase de entrenamiento.,Spanish
Climate is a measure of the long-term trends in the weather.,English
"[245] Additionally, there are bots designed to automatically notify editors when they make common editing errors (such as unmatched quotes or unmatched parentheses).",English
"Initially molten, the outer layer of the Earth cooled, resulting in the solid crust.",English
"und du bist bereit zu gehen und wenn dir dieses Video gefallen hat, vergiss nicht, uns einen Daumen hoch mit einem Kommentar zu geben.",German
"Data mining uses many machine learning methods, but with different goals; on the other hand, machine learning also employs data mining methods as ""unsupervised learning"" or as a preprocessing step to improve learner accuracy.",English
"I avhandlingen Frihetens rike: wikipedianer om sin praktik, sitt produktionssätt och kapitalismen (Uppsala universitet, 2015) undersöker Arwid Lund hur wikipedianer ser på sin roll som bidragsgivare till uppslagsverket.",Swedish
"er en meget fransk måde at sige møde eller dato på, for eksempel har jeg et møde med mine venner over frokosten på lørdag, eller jeg planlægger at møde med mine venner i indkøbscentret for film, at møde kan bruges både som substantiv eller som verbum for eksempel.",Danish
"frase número dois quando você não vê alguém por um tempo, você diz a ela há muito tempo que não vê, então isso significa que você não vê essa pessoa há semanas ou meses há muito tempo sem ver a frase número.",Portuguese
"Esto significa que varias personas pueden utilizar una cuenta o, más frecuentemente, una persona puede utilizar varias cuentas, a menudo en un intento de influir en el contenido de los artículos, o ayudar a crear consenso en las disputas editoriales.",Spanish
"Additionally, there are signs of human life in outer space today, such as material left over from previous manned and unmanned launches which are a potential hazard to spacecraft.",English
"[152]​ Para el 22 de enero de 2013, Wikipedia había migrado su centro de datos primario a una instalación de Equinix en Ashburn, Virginia.",Spanish
"tak på forhånd, hvis nogen begik en fejl, og han er virkelig ked af det.",Danish
di rubini le insalate di smeraldi e il pane laggiù è fatto di oro dorato pane quanto sarà bella questa marmellata e avrà un sapore delizioso con il pane che ha preso una fetta con la.,Italian
não muito.,Portuguese
faça alguns agradecendo com antecedência.,Portuguese
avoiding a question.,English
"af rubiner salater af smaragder og brød derovre er lavet af guldgyldent brød, hvor dejligt dette marmelade vil se ud og smage dejligt med det brød, hun tog et stykke med.",Danish
"seguro, no hay problema.",Spanish
One of the most important areas—automatic detection of vandalism[359][360] and data quality assessment in Wikipedia.,English
"Generellt betraktades företagens beteende som dåligt, medan Wikiscanner spåddes få stor betydelse för att övervaka kvaliteten på Wikipedia.",Swedish
As páginas de discussão anexadas a um projeto são muitas vezes usadas para coordenar as mudanças que ocorrem nos artigos relacionados com o projeto.,Portuguese
sei libero sabato prossimo?,Italian
"puedes hacerlo si alguien lo está haciendo realmente bien, puedes decirle que sigan con el buen trabajo que sigan con el buen trabajo como si fueran tan buenos como son y sigan con el buen trabajo seguir siendo otra frase es coloquial, y esto es lo que los estadounidenses decir.",Spanish
[55] Wikipedia è riconosciuta dal Guinness World Records (Guinness dei primati) come la più grande enciclopedia online[56] e come la più grande enciclopedia in assoluto.,Italian
Kannst du etwas langsamer sprechen?,German
gut erzogen und kultiviert und raffiniert.,German
"With 42.9 million unique visitors, Wikipedia was ranked number 9, surpassing The New York Times (#10) and Apple (#11).",English
det är ett bra skämt så frasen är att det är ett bra.,Swedish
[288][289] Wikipedia Zero was an initiative of the Wikimedia Foundation to expand the reach of the encyclopedia to the developing countries.,English
"[83]​ También existe la posibilidad de imprimir libros vía PediaPress, un programa socio de la fundación Wikimedia, mediante la misma solicitud.",Spanish
"[40] Wales disputed these claims in 2009, denying the decline and questioning the methodology of the study.",English
"[26] Wikipedia gained early contributors from Nupedia, Slashdot postings, and web search engine indexing.",English
[183] O website satírico Desciclopédia que parodia a Wikipédia.,Portuguese
you can just say no worries.,English
Cuídate.,Spanish
"In spite of this progress, however, the fate of human civilization remains closely linked to changes in the environment.",English
"In April 2019, an Israeli lunar lander, Beresheet, crash landed on the surface of the Moon carrying a copy of nearly all of the English Wikipedia engraved on thin nickel plates; experts say the plates likely survived the crash.",English
Algorithmic bias is a potential result from data not fully prepared for training.,English
Orlowski formuleerde het als volgt: de kwaliteit van informatie in deze artikelen was in Wikipedia daarmee 31 procent minder dan in de Britannica.,Dutch
Special interest groups have engaged in edit wars to advance their own political interests.,English
"Wikipedia is opgezet in de vorm van een wiki, hetgeen betekent dat elke inhoudelijke pagina door iedere bezoeker bewerkt kan worden.",Dutch
"para um país de língua inglesa, você pode usar isso totalmente.",Portuguese
"Oh je, eines Nachts, als sie schlief, saß ihre Mutter an ihrer Seite und beobachtete sie.",German
"Al contrario de lo que sucede con muchas otras, su contenido está liberado bajo licencias de contenido abierto.",Spanish
forslag.,Danish
La información obtenida por un algoritmo de aprendizaje no supervisado debe ser posteriormente interpretada por una persona para darle utilidad.,Spanish
i think that's a good idea.,English
"The first of these was the 1986 BBC Domesday Project, which included text (entered on BBC Micro computers) and photographs from more than a million contributors in the UK, and covered the geography, art, and culture of the UK.",English
"In some parts of the world, there are many lakes because of chaotic drainage patterns left over from the last Ice Age.",English
"Según estadísticas de Wikipedia, en 2020 ingresan mensualmente al sitio unos 1600 millones de dispositivos, tomando el promedio de los últimos doce meses.",Spanish
"Surface vegetation has evolved a dependence on the seasonal variation of the weather, and sudden changes lasting only a few years can have a dramatic effect, both on the vegetation and on the animals which depend on its growth for their food.",English
Los algoritmos genéticos son procesos de búsqueda heurística que simulan la selección natural.,Spanish
Wikipedia è stata vista come un esperimento sociale di democrazia.,Italian
hey beruhige dich zusammen noch ein Satz das.,German
"[187]​ En una entrevista con Jimmy Wales, representante de la Fundación Wikimedia, para EFE, este explicó su creencia de que la expansión de Internet en otros países ampliaría el uso de Wikipedia sobre todo en lugares subdesarrollados, creando de este modo una conexión de culturas.",Spanish
om du vill att någon bara låter som att gråta och klaga på något som inte händer kan du säga kom jag kan du göra det jag?,Swedish
"een andere manier om precies hetzelfde te zeggen wat je kunt zeggen: verhoog je spel, zoals harder werken, beter werken, verhoog je spel.",Dutch
"Ik wil je eraan herinneren dat als je op zoek bent naar slimme woorden voor een telefoongesprek, ik een link naar een video plaats.",Dutch
Over 200 servere er blevet sat op for i fællesskab at kunne håndtere den enorme mængde trafik.,Danish
Elle se distingue notamment par l'obligation pour les rédacteurs d'indiquer leur nom et de préciser leurs diplômes.,French
[21][22] Anche l'Accademia della Crusca si è espressa analogamente in più occasioni.,Italian
"o tonto, ahora has escuchado la palabra obtuso en geometría ángulo obtuso y ángulo agudo, por lo que un ángulo obtuso es un ángulo mayor de 90 grados pero menor de 180 grados.",Spanish
