Text,Language
"Os pedidos que não podem ser atendidos a partir do cache são enviados para servidores de balanceamento de carga executando o software Linux Virtual Server, que por sua vez, passa a solicitação para um dos servidores web Apache para a renderização de páginas do banco de dados.",Portuguese
"Idéalement, l'apprentissage visera à être non supervisé, c'est-à-dire que la nature des données d'entrainement n'est pas connue[17].",French
Ecosystems are composed of a variety of biotic and abiotic components that function in an interrelated way.,English
Wikipedia får kritik för att artiklarnas tillförlitlighet är blandad och för att vissa artiklar är mycket korta eller har knapphändigt med källhänvisningar.,Swedish
if something surprises you you can also say you gotta be kidding me like oh my god.,English
Grundlegende Grüße wie geht es dir?,German
you rock you rock?,English
eu vou ficar bem.,Portuguese
"L'exemple de Wikipédia a aussi suscité la création de projets plus spécialisés, comme l'encyclopédie thématique Memory Alpha, consacrée à l'univers de Star Trek, ou le site parodique Désencyclopédie.",French
"For the best performance in the context of generalization, the complexity of the hypothesis should match the complexity of the function underlying the data.",English
"In addition to the top six, twelve other Wikipedias have more than a million articles each (Russian, Italian, Spanish, Polish, Waray, Vietnamese, Japanese, Egyptian Arabic, Chinese, Arabic, Ukrainian and Portuguese), seven more have over 500,000 articles (Persian, Catalan, Serbian, Indonesian, Norwegian (Bokmål), Korean and Finnish), 44 more have over 100,000, and 82 more have over 10,000.",English
"não leve isso a sério como a sério, não fique tão chateado, não leve isso a sério.",Portuguese
en je weet dat het beste ervan was toen ik mijn trouwjurk droeg die ook van goud was.,Dutch
i don't have an opinion on the matter.,English
"que está aceso, o que significa que isso é incrível, muitos americanos disseram na Califórnia.",Portuguese
woher weißt du das?.,German
"[28]​ Wales cita el ensayo ""El uso del conocimiento en la sociedad"", escrito por el economista y filósofo de la escuela austriaca y Premio Nobel de Economía Friedrich Hayek, que leyó cuando era estudiante,[29]​ como «central» para su pensamiento acerca de «cómo gestionar el proyecto Wikipedia»[30]​[31]​[32]​[33]​ Hayek argumenta que la información está descentralizada —cada individuo solo conoce una pequeña fracción de lo que se conoce colectivamente— y, como resultado, las decisiones se toman mejor por aquellos con conocimientos locales, en lugar de por una autoridad central.",Spanish
"En 1943, le neurophysiologiste Warren McCulloch et le mathématicien Walter Pitts publient un article décrivant le fonctionnement de neurones en les représentant à l'aide de circuits électriques.",French
"¿Puedes esperar un momento, por favor?",Spanish
"Dans certains cas, les biais algorithmiques peuvent conduire à des situations de discrimination[36].",French
"[210] Sanger mais tarde esclareceu que as imagens, que eram relativas à pedofilia e uma sobre lolicon, não eram fotos de crianças verdadeiras, mas disse que eram ""representações visuais obscenas do abuso sexual de crianças"", nos termos do PROTECT Act de 2003.",Portuguese
were magical beings something that narcisse's mother knew nothing about terry melli oh it's so good to see you it's been very long hasn't it how have you been i have been very good i would have been better if only if only what if only my daughter narcisa was a little more understanding marian told mellie and terry all about narcisa and how she was worried for her she wants to eat bread made of gold what do i do with her well maybe if her dream comes true.,English
"mais vous n'obtiendrez pas ce prêt bancaire à moins que vous ne prouviez à la banque que vous avez suffisamment d'argent, alors la prochaine fois que vous serez coincé dans une situation délicate, rappelez-vous.",French
"oh chérie, une nuit alors qu'elle dormait, sa mère était assise à ses côtés en la regardant.",French
"han er så klar og suave, især foran damerne eller barack obama er så suave og poleret.",Danish
"I en intervju med The Guardian[62] 2004 sade Dale Hoiberg, Encyclopædia Britannicas chefredaktör, om engelskspråkiga Wikipedia: Intervjun publicerades 26 oktober 2004.",Swedish
"auf grausame Weise wird manchmal in Gefängnissen grausam auch im täglichen Leben verwendet, um über ein häufiges Fehlverhalten zu sprechen, und Sie möchten es übertreiben.",German
"Serverklustren finns (sedan januari 2013) i delstaten Virginia och har även speglade data i casheservrar i datacenter i Amsterdam som bland annat betjänar Europa, i Singapore för Asien samt i San Francisco och Texas för Amerika.",Swedish
Det låter bra.,Swedish
du måste äta allt detta jag trodde att du gillade snygga saker nej jag vill inte gifta mig med dig jag vill åka hem.,Swedish
any time.,English
Bland de som studerar använde 94 procent Wikipedia för att söka information.,Swedish
suggestions.,French
"Cada edición trabaja de forma independiente, no está obligada a incluir el contenido de otras ediciones, y solo debe respetar políticas globales tales como la de mantener un «punto de vista neutral».",Spanish
"Lernen Sie einige intelligente neue englische Wörter, die Sie in Ihrem täglichen Leben verwenden können, und erweitern Sie Ihren Wortschatz in wenigen Minuten.",German
[74] Obvious vandalism is generally easy to remove from Wikipedia articles; the median time to detect and fix vandalism is a few minutes.,English
"Páginas fortemente atacadas, artigos em particular, podem ser semiprotegidos de modo que apenas usuários registrados estabelecidos possam editá-los, ou para casos particularmente controversos, bloqueios podem ser usados para que apenas os administradores sejam capazes de fazer edições.",Portuguese
"försökte hjälpa dig, men kunde inte nå det resultat du kan säga.",Swedish
suggestions.,English
"Dann machst du wieder etwas und sagst, wo wir waren.",German
"La Turquie était le seul pays avec la Chine où toutes les éditions de Wikipédia étaient bloquées[141],[142],[143].",French
"""[113] However, Business Insider editor and journalist Henry Blodget showed in 2009 that in a random sample of articles, most content in Wikipedia (measured by the amount of contributed text that survives to the latest sampled edit) is created by ""outsiders"", while most editing and formatting is done by ""insiders"".",English
Las técnicas de agrupamiento hacen inferencias diferentes sobre la estructura de los datos; se guían usualmente por una medida de similitud específica y por un nivel de compactamiento interno (similitud entre los miembros de un grupo) y la separación entre los diferentes grupos.,Spanish
[100] Som en av internets största samarbetsprojekt och mest omfattande informationskällor har Wikipedia rönt uppmärksamhet i olika sammanhang.,Swedish
"Nature è una delle più antiche ed importanti riviste scientifiche esistenti, forse in assoluto quella considerata di maggior prestigio nell'ambito della comunità scientifica internazionale (insieme a Science).",Italian
"ik heb het verpest ik heb het verpest als je wilt dat iemand in plaats van mij werkt, kun je zeggen.",Dutch
"Sie könnten träge sein oder meine Füße ziehen, also waren das die 10 klugen Wörter und früher.",German
Wikipédia et ses projets parallèles sont des wikis libres.,French
what have you been up to raise them before if everything is going?,English
"Wikipedia var från början enbart engelskspråkigt, men 15 mars 2001 togs initiativet till flera språk.",Swedish
"No quiero esto, pero la comida es realmente buena.",Spanish
"Ich habe es vermasselt Ich habe es vermasselt, wenn du willst, dass jemand anstelle von mir arbeitet, kannst du sagen.",German
"Elle illustre la diversité des thèmes étudiés en écologie, et de façon plus générale dans les sciences naturelles.",French
"quelle a été votre erreur, nous allons vous nourrir quelque chose de gentil à partir de ce jour-là.",French
"Ett meritsystemverktyg skulle kunna motivera till meningsfulla redigeringar, men kan även ge upphov till konkurrens.",Swedish
proost ik waardeer het echt.,Dutch
"[56] Typically, the anomalous items represent an issue such as bank fraud, a structural defect, medical problems or errors in a text.",English
(2008).,Spanish
är du ledig nästa lördag?,Swedish
Jeg vil gerne hjælpe.,Danish
det sjunker säger du ta dig ihop som att bokstavligen ta dig själv och dra dig ihop sluta arbeta sluta gråta dra dig ihop.,Swedish
"[3] Oltre a Nature stesso, ci sono tre famiglie di riviste scientifiche legate a Nature, edite dal Nature Publishing Group: In un'intervista pubblicata nel 2013 su The Guardian, Randy Schekman rilascia delle dichiarazioni riguardanti le grandi riviste scientifiche (facendo il nome di Nature, Science o Cell), additandole come colpevoli di danneggiare l'attività di ricerca scientifica.",Italian
jag mår bra men tack för att du erbjuder.,Swedish
"so verblüfft zu sein, wird verwendet, um etwas zu beschreiben, das erstaunlich gut ist, zum Beispiel, dass sie in diesem Kleid verblüffend aussieht oder was für eine erstaunliche Aussicht von diesem Balkon oder ich lese dieses erstaunliche Buch, das ich nicht aufschreiben kann, wie es mit dir geht und sagen.",German
"Le contenu de Wikipédia est utilisé sur des sites webs, dans des devoirs scolaires, dans des études universitaires, des livres, des conférences et des affaires judiciaires[147].",French
Seigenthaler was falsely presented as a suspect in the assassination of John F.,English
"[74] There are many applications for machine learning, including: In 2006, the media-services provider Netflix held the first ""Netflix Prize"" competition to find a program to better predict user preferences and improve the accuracy of its existing Cinematch movie recommendation algorithm by at least 10%.",English
"Was sagst du, wir gehen ins Kino?",German
El algoritmo de CART es una implementación de esta estrategia.,Spanish
"Eftersom öppna nätverk fortfarande är en ny företeelse för de flesta, är många besökares första redigering rent klotter - de testar om ""Redigera den här sidan"" verkligen är det den ger sig ut för att vara.",Swedish
det vanliga.,Swedish
"Em janeiro de 2005, o projeto funcionava através de 39 servidores dedicados localizados na Flórida.",Portuguese
Elle finance l'hébergement web de l'encyclopédie.,French
"L'attività di wikipediano è riconosciuta come ""profilo professionale"" dall'IWA (International Webmasters Association).",Italian
"Ein weiteres Beispiel für Catch-22 ist, dass Sie einen Bankkredit benötigen, weil Sie nicht genug haben.",German
"Katherine Maher, the nonprofit Wikimedia Foundation's chief communications officer, said the changes address a sentiment among volunteer editors that, 'we're not an advertising service; we're an encyclopedia.",English
"[15][16] Nupedia was initially licensed under its own Nupedia Open Content License, but even before Wikipedia was founded, Nupedia switched to the GNU Free Documentation License at the urging of Richard Stallman.",English
"til et engelsktalende land, kan du helt bruge dette.",Danish
Jag skulle hellre att du inte gjorde det.,Swedish
Tenho um encontro com meus amigos esta noite ou vou me um encontro com meus amigos amanhã.,Portuguese
und erhalten Sie diese bewundernden Blicke von Ihren Freunden.,German
"After some editors who volunteer to maintain the site argued that the decision to delete had been made hastily, Wales voluntarily gave up some of the powers he had held up to that time as part of his co-founder status.",English
"c'est une bonne blague, donc la phrase est bonne.",French
"[71][72] Conversely, machine learning techniques have been used to improve the performance of genetic and evolutionary algorithms.",English
È molto gentile da parte sua.,Italian
"Eu não me importo se alguém está perguntando algo e esta é uma decisão muito fácil para você, como se alguém dissesse para você pegar meu 1 milhão de dólares e você dissesse que isso é um acéfalo.",Portuguese
Concluye diciendo que «una mayor presencia de la comunidad universitaria y escolar sería un auténtico soplo de aire fresco» para la enciclopedia.,Spanish
"Accessdatum är viktigt, eftersom Wikipediaartiklar förändras.",Swedish
Eu não estava ouvindo outra frase que uso o tempo todo.,Portuguese
"Kannst du mich abdecken, es ist Zeit zu gehen und Leute, ich sollte besser gehen, was bedeutet, dass ich schon gehen sollte.",German
"säger ""jag vet inte"".",Swedish
Grazie mille.,Italian
hoy me vendría bien una bebida energética.,Spanish
Veuillez accepter mes excuses.,French
se puede decir gracias al cielo es viernes o pensar que el cielo dijo sábado descubrimiento de fin de semana.,Spanish
"Toutefois, il est à souligner que le magazine Marianne rappelle qu'en quelques heures, ""Ellen"" a été remplacé par ""Elliot"" dans les titres d'articles, sur la fiche wikipédia de Elliot Page[87].",French
"Economist Tyler Cowen wrote: ""If I had to guess whether Wikipedia or the median refereed journal article on economics was more likely to be true after a not so long think I would opt for Wikipedia.""",English
"El carruaje dorado se acercó a ellos, estaba tachonado de gemas y diamantes y se veía extremadamente impresionante.",Spanish
"Le deuxième était un Webby Awards dans la catégorie « communauté », remis par l'International Academy of Digital Arts and Sciences, basée à New York[155].",French
"Wikikod används även för att skapa mallar med innehåll som kan återanvändas i flera olika artiklar, och vars utformning kan anpassas med hjälp av olika parametrar.",Swedish
Met deze kritische aandacht sloot Wikipedia goed aan bij het gedachtegoed van Erasmus.,Dutch
"met haar enige dochter was narcisa marion buitengewoon nederig en lieve narcisa was echter helemaal het tegenovergestelde, je ziet dat ze mooi was zonder woorden, ze was als een leven.",Dutch
Ik verdrink in mijn werk.,Dutch
"""[143] A Wikipédia é uma enciclopédia hospedada e financiada pela Fundação Wikimedia, uma organização sem fins lucrativos que opera a Wikipédia e projetos relacionados, tais como o Wikcionário, Wikilivros e outros.",Portuguese
"no, sorry, i've already mad some plans.",English
"D'autres hyperliens permettent de naviguer entre les différentes versions linguistiques ou de conduire vers ses projets frères, par exemple pour fournir une définition d'un mot sur le Wiktionnaire ou une galerie d'images sur Wikimedia Commons[o].",French
"A estrutura aberta da Wikipédia faz com que ela seja um alvo fácil para os trolls, spams e aqueles procuram usar o projeto para espalhar suas ideias.",Portuguese
Pensé que te gustaban las cosas elegantes.,Spanish
"Ik zou graag iets willen doen, maar ik kan het niet.",Dutch
vi' Jag har lärt oss en hel del av dessa smarta ord och vi tenderar att fylla två tre fyra av dem i en mening som inte låter naturligt.,Swedish
There is neither a separate reinforcement input nor an advice input from the environment.,English
"Computer programs called bots have often been used to perform simple and repetitive tasks, such as correcting common misspellings and stylistic issues, or to start articles such as geography entries in a standard format from statistical data.",English
"[42] Addetti ai lavori del mondo cartaceo (bibliotecari, accademici, redattori ed editori di enciclopedie classiche) considerano invece Wikipedia di scarsa o nulla utilità quale mezzo di consultazione.",Italian
ce fut un plaisir de vous rencontrer plus tard.,French
tænk bare på den stakkels narcissemor var så bekymret for sin datter og hvordan.,Danish
tu veux faire quelque chose ce week-end?,French
"Privatisé, car les algorithmes d’AA constituent des gigantesques opportunités économiques, et obscurs car leur compréhension passe derrière leur optimisation.",French
Wikipedia è stata accusata di insufficienza nella conoscenza a causa della sua natura volontaria e di riflettere i pregiudizi sistemici dei suoi collaboratori.,Italian
"Earth is estimated to have formed 4.54 billion years ago from the solar nebula, along with the Sun and other planets.",English
Questo premio fu accompagnato da un finanziamento di 10.000 euro e da un invito a presenziare al PAE Cyberarts Festival di quell'anno.,Italian
"Ad esempio, il miglior programma di computer al mondo per backgammon, TD-Gammon[35], ha sviluppato la sua strategia giocando oltre un milione di partite di prova contro se stesso.",Italian
De meeste opslagcapaciteit is nodig voor de afbeeldingen en andere media die op Wikipedia gebruikt worden.,Dutch
Dio mio.,Italian
"[6][7] No dia 14 de dezembro de 2005, a revista Nature publicou um artigo sobre a Wikipédia a respeito de uma pesquisa feita comparando alguns de seus artigos com os da enciclopédia Britânica em áreas científicas quanto à quantidade de erros encontrados.",Portuguese
"og de er som om jeg vil købe det samme, og jeg fortæller dem, at du solgte det, du solgte mig, jeg ville ikke købe det okay, du solgte mig, hvis du ikke er interesseret i samtalen.",Danish
"[185]​ Fuera del sitio web, otros han expresado las impresiones personales que el sitio les produce.",Spanish
je ne suis pas sûr d'être d'accord.,French
"Elles reprennent généralement l'intitulé « Wikimedia » (Wikimédia Belgique, Wikimédia France[ag], Wikimédia Suisse[ah], etc.).",French
tem planos para amanhã?,Portuguese
i frankrike användes tidigare möte av armén för att ange en mötesplats för trupperna nu finns det något lite spännande och hemlighetsfullt om ordet möte även nu så medan du kan använda möte för alla möten.,Swedish
"säker, inga problem.",Swedish
well-mannered the word suave has several different origins but one very interesting  origin of the word is which means pleasant or sweet tasting example.,English
mais non dans un correctif signifie être dans une situation gênante d'autres mots que vous pouvez utiliser à la place d'un correctif sont je suis dans une soupe ou je ' Je suis dans un désordre ou je suis dans un endroit ennuyeux ou juste je suis dans un endroit.,French
"[64]​[65]​ Además, sus contenidos están disponibles en formato impreso.",Spanish
"[nota 7] Por razões legais, o conteúdo na Wikipédia está sujeito às leis (lei de direitos autorais em particular) da Flórida, onde os servidores da Wikipédia estão hospedados.",Portuguese
"Esta aplicación es libre, gratuita y solo funciona en el iPhone 3G o en versiones más recientes.",Spanish
"Ma con qualcosa come questo, tutto ciò perde di significato».",Italian
"adoraria fazer algo, mas não posso.",Portuguese
"zeggen ""ik weet het niet"".",Dutch
"[28] Citing fears of commercial advertising and lack of control in Wikipedia, users of the Spanish Wikipedia forked from Wikipedia to create the Enciclopedia Libre in February 2002.",English
essere d'accordo e non essere d'accordo.,Italian
"Instead, a cluster analysis algorithm may be able to detect the micro-clusters formed by these patterns.",English
there's too much on my plate i'm drowning in work.,English
"Eres como estar sentado, puedes decir que no me importa si esto es tan aburrido.",Spanish
Africa is the most underrepresented.,English
"More than half of this area is over 3,000 meters (9,800 feet) deep.",English
i love you sold me because sometimes people describe their trip or somebody they bought and they describe it is so well.,English
Ce noyau de fer est composé d'une phase interne solide et d'une phase externe fluide.,French
per favore accetta le mie scuse.,Italian
Outras palavras que você pode usar em vez de em uma solução são estou em uma sopa ou eu ' estou bagunçado ou em um ponto de incômodo ou apenas em um ponto a palavra inteligente número 7 é flummox flummox significa confundir alguém.,Portuguese
Penso che ti sbagli.,Italian
"Over time, Wikipedia has developed a semi-formal dispute resolution process to assist in such circumstances.",English
"[67] Em resposta ao pedido da Fundação Wikimedia, em novembro de 2008, a Free Software Foundation (FSF) lançou uma nova versão da GFDL concebida especificamente para permitir à Wikipédia relicenciar seu conteúdo para CC-BY-SA em 1 de agosto de 2009.",Portuguese
"Si vous disposez d'ouvrages ou d'articles de référence ou si vous connaissez des sites web de qualité traitant du thème abordé ici, merci de compléter l'article en donnant les références utiles à sa vérifiabilité et en les liant à la section « Notes et références » En pratique : Quelles sources sont attendues ?",French
"The site currently uses Lucene Search 2.1,[235][needs update] which is written in Java and based on Lucene library 2.3.",English
oh bobo ele é rico e bonito o que mais eu poderia querer terrence?,Portuguese
"Para mim, esse é o melhor restaurante da cidade.",Portuguese
¿De dónde sacaste las noticias como tú?,Spanish
het is het niet waard.,Dutch
"Resultados novos são excessivamente relatados em artigos de revistas, enquanto informações relevantes são omitidas do noticiário.",Portuguese
Vanaf de zomer van 2001 zijn er naast de oorspronkelijke Engelstalige versie steeds meer Wikipedia's in andere talen gestart.,Dutch
zu meiner Mutter lass mich nach Hause gehen Melissa und Terrence sahen sich an und zwinkerten gut.,German
ik ben bang dat ik het niet kan. aanbiedingen doen.,Dutch
Generalizations of Bayesian networks that can represent and solve decision problems under uncertainty are called influence diagrams.,English
"cuál fue tu error, vamos a darte de comer algo lindo a partir de ese día.",Spanish
você se importaria de me emprestar algum dinheiro?,Portuguese
"AI can be well equipped in making decisions in certain fields such technical and scientific which rely
heavily on data and historical information.",English
"Ich wusste, dass ich so viele Reichtümer verdiene.",German
"[24][25] Uma pesquisa de 2005 na revista Nature mostrou que os artigos científicos que eles compararam chegavam perto do nível de precisão da Encyclopædia Britannica e tinham uma taxa semelhante de ""erros graves"".",Portuguese
"quindi oggi impareremo 10 nuove parole intelligenti, i loro significati, parole di base e frasi di esempio, quindi andiamo avanti ehi tutti, questo è e state guardando.",Italian
Med hänvisning till denna forskning har debattörer därför beskrivit Wikipedia som en möjlig lösning på internets största problem med osaklig polarisering och desinformation.,Swedish
"in generale ma ha vinto ' Non è molto appropriato per un incontro ufficiale, quindi se hai un appuntamento forse puoi sicuramente dire che una parola intelligente rendezvous numero 9 è ottuso ottuso ottuso è un insulto che useresti quando stai cercando di chiamare qualcuno stupido o non intelligente.",Italian
"[192] The Economist argued that better-written articles tend to be more reliable: ""inelegant or ranting prose usually reflects muddled thoughts and incomplete information"".",English
"Según Ortega Soto (2009) las principales versiones de Wikipedia (inglesa, alemana, japonesa, española, etc) estaban perdiendo usuarios porque los nuevos editores no compensaban en número a los veteranos que abandonaban la edición.",Spanish
"Le développement des sciences et des techniques au cours des deux derniers siècles a été, de son côté, largement accompagné par une idéologie d'opposition entre l'Homme et la Nature, la connaissance étant généralement perçue comme un instrument de domination de la Nature plutôt que comme un moyen de vivre en harmonie avec elle.",French
[79] This artistic movement also coincided with the Transcendentalist movement in the Western world.,English
"Desde su inicio en 2001, Wikipedia ha utilizado diferentes marcas corporativas.",Spanish
Ja tack.,Swedish
"L'idea è di fornire una provenienza della fonte su ciascun intervallo del testo di una voce, e una provenienza temporale per indicarne l'annata.",Italian
"Les préoccupations environnementales actuelles montrent combien il importe d'identifier ces sens et leurs finalités dans chaque contexte particulier : suivant la définition utilisée, le rapport de l'Humanité à la « nature » n'est pas le même, et l'idée de « conservation de la nature » change d'objet, d'objectifs et de méthodes[1].",French
Det anses allmänt bland sociologer att det behövs en kritisk massa när en heterogen grupp med individer med både olika förutsättningar och motivation ska komma igång med att producera ”allmän egendom”.,Swedish
"On parle de classification ou de classement[3] si les étiquettes sont discrètes, ou de régression si elles sont continues.",French
"Il secondo è stato un Webby Award (premio annuale per i migliori siti web) proposto dalla giuria per la categoria ""Comunità"".",Italian
"non ne vale la pena, personalmente amo la frase you rock che significa che sei fantastico.",Italian
oh cara una notte mentre dormiva sua madre sedeva al suo fianco a guardarla.,Italian
"269 språkversioner hade i september 2020 över ettusen artiklar, och 30 språk hade då fler än en miljon artiklar.",Swedish
Les algorithmes d'apprentissage automatique posent des problèmes d'explicabilité globale du système.,French
nu använder vi ofta ordet häftigt här ' s ett annat ord som du kan använda istället för häpnadsväckande häpnadsväckande till exempel idag fick jag en häpnadsväckande poäng på mitt test vilket innebär att jag fick en mycket hög poäng eller.,Swedish
"This follows Alan Turing's proposal in his paper ""Computing Machinery and Intelligence"", in which the question ""Can machines think?""",English
