Text,Language
Hej och välkommen.,Swedish
"La programmazione logica induttiva (anche ILP, dall'inglese inductive logic programming) è un approccio all'apprendimento di regole che usa la programmazione logica come rappresentazione uniforme per gli esempi di input, per la conoscenza di base della macchina, e per le ipotesi.",Italian
"ja, snälla, fortsätt.",Swedish
Estaré bien.,Spanish
"[217] Em 9 de fevereiro de 2006 a liminar contra a Wikimedia Deutschland foi anulada, com o juiz rejeitando a noção de que o direito de privacidade de Tron ou de seus pais estivesse sendo violado.",Portuguese
Dessa kallas sock puppets eller marionetter.,Swedish
"Ces images, dont beaucoup ont une valeur historique, servent ensuite d'illustrations à des articles de Wikipédia, des sites web et des journaux en ligne.",French
"Arquivos de mídia cobertos por licenças de conteúdo livre (por exemplo, CC-BY-SA) são compartilhados entre as diferentes edições da Wikipédia através do repositório Wikimedia Commons, um projeto também operado pela Fundação Wikimedia.",Portuguese
no worries.,English
Esta es una lista de las grafías alternativas usadas para nombrar a Wikipedia en las diferentes ediciones:[53]​ Nota: Cada asterisco (*) denota una referencia respectiva por la múltiple adopción lingüística.,Spanish
"dat is verlicht, wat betekent dat dat verbazingwekkend is, zeiden veel Amerikanen in Californië.",Dutch
[49][50][51] Manifold learning algorithms attempt to do so under the constraint that the learned representation is low-dimensional.,English
laissez-moi réfléchir un instant.,French
"""[204] A Wikipédia tem sido criticada por permitir a publicação em seus artigos de materiais visuais de conteúdo sexual, como imagens e vídeos de masturbação e ejaculação, bem como cenas de filmes pesadamente pornográficos.",Portuguese
"Ich fürchte, ich bin anderer Meinung.",German
"The present era is classified as part of a mass extinction event, the Holocene extinction event, the fastest ever to have occurred.",English
"Wikipedia perciò è anche la prima tra le grandi enciclopedie che permette a tutti di osservare il processo di sviluppo nel tempo di una voce e di verificare se, come e dove il contenuto è stato oggetto di controversie.",Italian
at bruge ordet catch-22.,Danish
"y ellos dicen que quiero comprar lo mismo y les digo que lo vendiste, me vendiste, yo no compraría esto bien, me vendiste si no estás interesado en la conversación.",Spanish
"Jusqu'en 2009, le contenu textuel de Wikipédia était publié sous la Licence de documentation libre GNU (GFDL).",French
"Allo stesso tempo i difensori e fruitori ne esaltano la ""portabilità"" rispetto alle enciclopedie cartacee ovvero la disponibilità a portata di un ""click"".",Italian
"[68][69] A utilização de arquivos de mídia (por exemplo, arquivos de imagem) varia entre as várias edições em diferentes idiomas.",Portuguese
"On February 9, 2006, the injunction against Wikimedia Deutschland was overturned, with the court rejecting the notion that Tron's right to privacy or that of his parents was being violated.",English
Les pages sont en outre reliées les unes aux autres par des hyperliens internes permettant au lecteur de se déplacer à travers l'encyclopédie[n].,French
"Il nous faut « reconnaître à qui et à quoi nous devons la vie - et le verbe ""devoir"", ici, nous oriente vers la gratitude et le soin, nous invite à cultiver des relations d'affiliation, à assumer des responsabilités et des devoirs -.",French
quoi de neuf?,French
sugestões.,Portuguese
Je suis désolé.,French
"Gli esempi di addestramento (in inglese chiamati training examples) si assume provengano da una qualche distribuzione di probabilità, generalmente sconosciuta e considerata rappresentativa dello spazio delle occorrenze del fenomeno da apprendere; la macchina ha il compito di costruire un modello probabilistico generale dello spazio delle occorrenze, in maniera tale da essere in grado di produrre previsioni sufficientemente accurate quando sottoposta a nuovi casi.",Italian
"Wikipediaartiklars trovärdighet vilar mycket på dess källor och på att ett stort antal personer bevakar, granskar och bidrar till artiklarna, medan andra uppslagsverk vilar på att dess författare är experter som anses vara auktoriteter på sina områden.",Swedish
aveva occhi così piccoli quasi come quelli di un uccello e l'altro aveva un naso enorme non avrei voluto stargli vicino.,Italian
hoe gaat het?.,Dutch
Wikipediaartiklar anses emellertid främst användbara för att hitta andra mer auktoritativa källor snarare än som informationskälla till egna publikationer.,Swedish
"En 2015, une image 3D de la même volumétrie 2009, reprenant une étude menée par Jacopo Farina et ses collègues[47], a été réalisée à l'aide du logiciel Minecraft[43].",French
göra planer.,Swedish
Ett innehållsdrivet meritsystem riskerar att bidragsgivare av rädsla för att sänka sin meritstatus försöker förhindra att deras text ändras.,Swedish
Alcune edizioni comunque accettano solo contenuti multimediali liberi da copyright.,Italian
come va?,Italian
Es steht mir nicht frei zu sagen.,German
"[78] In 2012, co-founder of Sun Microsystems, Vinod Khosla, predicted that 80% of medical doctors' jobs would be lost in the next two decades to automated machine learning medical diagnostic software.",English
Le contenu figurant sur Wikipédia a également été cité comme une source de référence dans certains rapports de la communauté du renseignement des États-Unis[135].,French
"[162]​ A este respecto, es bastante ilustrativo el experimento realizado por Shane Fitzerald, un estudiante universitario dublinés de 22 años, publicado el 6 de mayo de 2009 por el periódico IrishTimes.com:[163]​[164]​ Tras enterarse del fallecimiento de Maurice Jarre unas horas antes, Shane editó el artículo correspondiente al compositor para incluir una cita ficticia: Poco después la cita apareció en las secciones necrológicas de los periódicos The Guardian y The London Independent, en el sitio web The BBC Music Magazine y en periódicos de la India y Australia.",Spanish
MediaWiki est sous licence GNU GPL et est en 2010 utilisé par tous les projets Wikimedia ainsi que par de nombreux autres sites wikis.,French
e ouvir a pronúncia uma ou duas vezes.,Portuguese
Sorry dat ik u onderbreek.,Dutch
"""[213] Na sequência da queixa apresentada por Larry Sanger, Wales excluíu imagens sexuais sem consultar a comunidade.",Portuguese
¿Estás libre el próximo sábado?,Spanish
"For more advanced tasks, it can be challenging for a human to manually create the needed algorithms.",English
"La rivista di informatica tedesca c't nell'ottobre 2004 ha fatto un confronto tra le enciclopedie Brockhaus Premium, Microsoft Encarta e Wikipedia.",Italian
Usan métodos tales como la mutación y el cruzamiento para generar nuevas clases que puedan ofrecer una buena solución a un problema dado.,Spanish
dus dit is een geweldige manier om te oefenen waar waren we ook alweer als je midden in een gesprek zit?,Dutch
för mig under det att berätta för mig vilka av dessa tio ord som är din favorit och också.,Swedish
"[94] Um estudo de 2007 realizado por pesquisadores da Faculdade de Dartmouth descobriu que ""colaboradores anônimos e pouco frequentes na Wikipédia são confiáveis e uma fonte de conhecimento tanto quanto os contribuintes que se inscrevem no site.",Portuguese
"Ei, por que você não sai com a gente, você pode dizer a eles que sinto muito, mas estou atolado de trabalho ou estou atolado com algumas outras palavras que você pode usar no lugar de atolado, eu tenho demais façam.",Portuguese
"No importa, supongo que con el tiempo ella aprenderá a hablar, hablemos de otra cosa.",Spanish
non prenderlo a cuore come sul serio non essere così arrabbiato non prenderlo a cuore.,Italian
"Was hast du gemacht, um sie zu erziehen, wenn alles läuft?",German
"[258] Following growing amounts of incoming donations exceeding seven digits in 2013 as recently reported,[43] the Foundation has reached a threshold of assets which qualify its consideration under the principles of industrial organization economics to indicate the need for the re-investment of donations into the internal research and development of the Foundation.",English
"Depuis 2016, des applications mobiles contenant le corpus médical de l'encyclopédie ont également fait leur apparition sous Android, toujours grâce à Kiwix, sous le nom de WikiMed.",French
"In unsupervised feature learning, features are learned with unlabeled input data.",English
"Parmi les contributeurs, 48 % d'entre eux avaient fait des études supérieures, et 20 % obtenu un master ou plus.",French
Espera un momento.,Spanish
"[29] Ook werd in 2008 een platenhoes niet verwijderd nadat een Britse organisatie die hoes als kinderpornografie had bestempeld, waardoor in grote delen van het Verenigd Koninkrijk Wikipedia niet meer bereikbaar was.",Dutch
A continuación se muestran una serie de temas que podrían formar parte del temario de un curso sobre aprendizaje automático.,Spanish
"Wanneer niemand doorheeft dat de informatie onjuist is, kan die maandenlang op Wikipedia blijven staan.",Dutch
it's actually 1 9 p.m.. right now.,English
"In un'analisi sulle enciclopedie online, i professori della Indiana University Emigh e Herring, hanno poi sostenuto che «Wikipedia apporta miglioramenti alle tradizionali fonti di informazione, specialmente per le aree in cui è forte, come tecnologia e avvenimenti d'attualità».",Italian
"L'apprendimento automatico viene a volte unito al data mining,[25] che si focalizza maggiormente sull'analisi esplorativa dei dati ed utilizza principalmente il paradigma di apprendimento chiamato ""apprendimento non supervisionato""[26].",Italian
ik ben zo blij dat dit het was jongens 50 zinnen in het engels laat me weten of dit nuttig was door deze video leuk te vinden en hieronder te reageren als je nog meer coole zinnen kent.,Dutch
"Por ello, en la Wikipedia en inglés puede aparecer cualquier imagen ilustrativa siempre que lo haga de manera lícita.",Spanish
"Oprindeligt startede Wikipedia med at køre på UseModWiki, skrevet af Clifford Adams.",Danish
Jag tror verkligen inte att det kommer att fungera.,Swedish
"Algunos sistemas de aprendizaje automático intentan eliminar toda necesidad de intuición o conocimiento experto de los procesos de análisis de datos, mientras otros tratan de establecer un marco de colaboración entre el experto y la computadora.",Spanish
entschuldigen Sie mich?,German
"Vanaf 2005 begonnen de bewerkers (users, in het Nederlands vaak ""gebruikers"" genoemd) op Wikipedia steeds meer samen te werken met culturele instellingen en andere organisaties om meer materiaal beschikbaar te krijgen voor het gebruik op Wikipedia.",Dutch
"se vuoi che qualcuno suoni come se stesse piangendo e lamentandosi di qualcosa che non sta succedendo puoi dire vieni io, puoi farlo io?",Italian
"[21] The domains wikipedia.com and wikipedia.org were registered on January 12, 2001,[22] and January 13, 2001,[23] respectively, and Wikipedia was launched on January 15, 2001,[14] as a single English-language edition at www.wikipedia.com,[24] and announced by Sanger on the Nupedia mailing list.",English
wasn't able.,English
Ciò si pone in controtendenza con altri tipi di apprendimento automatico che normalmente identificano un singolo modello che può essere applicato universalmente ad ogni istanza per riuscire a fare su di essa una previsione[30].,Italian
"Por exemplo, Chris Anderson, editor-chefe da revista Wired, escreveu na revista Nature que a abordagem de ""sabedoria das multidões"" da Wikipédia não substitui as revista científicas com os seus rigorosos processos de revisão.",Portuguese
"Wenn Sie jemanden bitten, nicht verärgert zu sein, nicht zu weinen, können Sie sagen, nehmen Sie es sich nicht zu Herzen.",German
Otra forma de decirle a la persona que no se enoje es decirle que las cosas pasan como si estuviera bien.,Spanish
"[213] O porta-voz da Wikimedia Foundation, Jay Walsh, disse que a Wikipédia não possui ""material que consideremos ilegal.",Portuguese
"Alles, was Sie wollen, finden Sie hier, von den schönsten Kleidern bis zu den leckersten Lebensmitteln In meinem Palast, wo ich gerade von Essen spreche, bin ich nach dieser Fahrt wirklich hungrig.",German
"Because of the extent of human influence, the boundaries between what humans regard as nature and ""made environments"" is not clear cut except at the extremes.",English
"However, not every definition of life considers all of these properties to be essential.",English
"hvad siger du, vi går i biografen?",Danish
cosa succede se non hai notato qualcosa o non ha capito la persona a cui puoi sempre chiedere ti ho capito bene?,Italian
"Die Situation ist, dass Sie etwas nicht bekommen haben und dann einen zusätzlichen Effekt bekommen, und Sie bekommen es.",German
"Na prática, o tempo médio para detectar e corrigir vandalismos é muito baixo, normalmente de alguns minutos,[24][25] mas em um incidente particularmente bem divulgado, uma informação falsa foi introduzida na biografia do político estadunidense John Seigenthaler e permaneceu despercebida por quatro meses.",Portuguese
"They are coordinated in part by Meta-Wiki, the Wikimedia Foundation's wiki devoted to maintaining all its projects (Wikipedia and others).",English
meningen.,Dutch
"estar atordoado tão estupendo é usado para descrever algo que é incrivelmente bom, por exemplo, ela parece estupenda naquele vestido ou que vista estupenda desta varanda ou eu estou lendo este livro estupendo que não consigo largar, que tal você vai e contar.",Portuguese
"Até o final de 2001, o site já havia crescido para cerca de 20 000 artigos em 18 idiomas.",Portuguese
En Wikipedia el registro es gratuito e instantáneo.,Spanish
[135]​ A algunos usuarios que ya llevan un cierto tiempo editando en Wikipedia sin problemas se les asigna la categoría de autoconfirmados; sus ediciones aparecen en la página de cambios recientes con un fondo diferente al del resto de los usuarios.,Spanish
evitando una domanda.,Italian
"Projektet bygger på wikiprogramvaran Mediawiki, som är uteslutande fri och har öppen källkod.",Swedish
"Ich bin aufgewacht, sie hat alle gelächelt und hier gekichert, Schatz, sag mir, wovon hast du geträumt?",German
La revista es leída por científicos e investigadores de todo el mundo siendo la mayor parte de los artículos exposiciones de trabajos de investigación muy técnicos.,Spanish
"Ich weiß nicht, an welchem ​​Tag Sie dieses Video sehen, aber wenn es Freitag ist, zum Beispiel am Wochenende.",German
"L'apprendimento automatico viene impiegato in quei campi dell'informatica nei quali progettare e programmare algoritmi espliciti è impraticabile; tra le possibili applicazioni citiamo il filtraggio delle email per evitare spam, l'individuazione di intrusioni in una rete o di intrusi che cercano di violare dati,[6] il riconoscimento ottico dei caratteri[7], i motori di ricerca e la visione artificiale.",Italian
[21] I 2017 annoncerede Facebook at siden ville hjælpe læsere med at detektere fake news ved at foreslå links til relaterede Wikipedia-artikler.,Danish
"La question de responsabilité est d’autant plus compliquée que la priorité chez les concepteurs réside en la conception d’un algorithme optimal, et non pas de le comprendre.",French
"Nein, ich will dich nicht heiraten.",German
sorry i wasn't listening.,English
"Il se veut aussi multilingue[25] et gratuit[26] dans sa version en ligne, afin de favoriser l'accès du plus grand nombre à la connaissance.",French
"grazie comunque non importa, ma grazie comunque.",Italian
"e você não entendeu o que a outra pessoa estava dizendo, você pode dizer que estava dizendo e com um ponto de interrogação.",Portuguese
"Il est significatif de constater que dans ce contexte de déchristianisation, parmi les fêtes civiques, c'est la fête de la nature qui aura réellement du succès.",French
[noot 1] De bewerkers van Wikipedia zijn merendeels mannelijk.,Dutch
"Fornendo questa definizione, Mitchell di fatto segue la proposta che Alan Turing fece nel suo articolo ""Computing Machinery and Intelligence"", sostituendo la domanda ""Le macchine possono pensare?""",Italian
Zo bevatte de Wikipedia in het Zazaki begin 2010 ongeveer 2800 artikelen.,Dutch
Others have the view that not all of ML is part of AI[23][24][25] where only an 'intelligent' subset of ML is part of AI.,English
"Em consequência do referendo, o Conselho Diretivo da Wikimedia votou para mudar para a licença Creative Commons.",Portuguese
"Rather than ""sapere aude"" (lit.",English
"[37] In addition to performance bounds, learning theorists study the time complexity and feasibility of learning.",English
"Letzte Nacht, Mama, es war so ein erstaunlicher Traum, dass du weißt, dass dieser Prinz auf mich zukam.",German
"[172] Em dezembro de 2008, a revista científica RNA Biology lançou uma nova seção para a descrição de famílias de moléculas de RNA e requereu que os autores que contribuem para a seção também apresentassem um projeto de artigo sobre o RNA familiar da Wikipédia.",Portuguese
"[138] For instance, Meta-Wiki provides important statistics on all language editions of Wikipedia,[139] and it maintains a list of articles every Wikipedia should have.",English
adelante.,Spanish
tenía ojos tan pequeños casi como los de un pájaro y el otro tenía una nariz enorme que no me gustaría estar cerca de él.,Spanish
"No estoy cansado, no de que cuando alguien me pregunte, ¿estás seguro y estás bastante seguro de que puedes decir que no hay espacio para eso?",Spanish
"og du er som åh, det forklarer det, der forklarer det.",Danish
"[73] Man-made threats to the Earth's natural environment include pollution, deforestation, and disasters such as oil spills.",English
ma no in una soluzione significa essere in una situazione problematica altre parole che puoi usare invece che in una correzione sono io sono in una zuppa o io Sono in un pasticcio o sono in un punto di fastidio o semplicemente sono in un posto La parola intelligente numero 7 è flummox flummox significa confondere qualcuno.,Italian
"se alguém conseguiu o emprego dos seus sonhos ou o que quer que você possa dizer com sorte ou alguém entrou na universidade dos seus sonhos como sorte sua, esta é uma forma de parabenizar a pessoa sortuda de você ou apenas enfatizar que ele tem sorte de você outra forma de dizer que você está realmente bravo é dizer que eu surtei como se eu estivesse com tanta raiva que eu surtei, isso é super raiva.",Portuguese
che cosa succede?,Italian
"Lors du 5e symposium international sur le journalisme en ligne, Jonathan Dee, du New York Times[6], et Andrew Lih[7] mentionnent l'importance de Wikipédia, non seulement comme une encyclopédie de référence mais aussi comme une ressource d'actualités très fréquemment mise à jour.",French
[144]​ Regularmente operan en Wikipedia varios sistemas de edición automática.,Spanish
låt mig komma tillbaka till dig om det.,Swedish
Une étude montre que ces articles diffèrent selon les langues de l'encyclopédie[67].,French
"""[159] Outros defendem a ideia de que a Wikipédia, ou projetos semelhantes, deverá deslocar inteiramente publicações tradicionais.",Portuguese
"En violant la vie privée de nos usagers, la NSA menace la liberté intellectuelle qui est centrale pour la capacité à créer et à comprendre des connaissances »[136].",French
"L'espace « Principal » contient les articles encyclopédiques, qui peuvent être rangés dans une ou plusieurs catégories, lesquelles peuvent être organisées selon une hiérarchisation arborescente et thématique (par exemple « Pays d'Europe », puis « Italie », puis « Ville d'Italie »)[m].",French
[30] Turkije blokkeerde van 29 april 2017 tot 16 januari 2020[31] de toegang tot alle talenversies van Wikipedia nadat de encyclopedie had geweigerd sommige inhoud te verwijderen.,Dutch
Me temo que no tengo ni idea.,Spanish
"Ich glaube ehrlich gesagt nicht, dass es funktionieren wird.",German
"Sur chaque page, des onglets permettent d'accéder aux fonctions de modification, soit par l'intermédiaire d'un éditeur visuel, soit par l'intermédiaire du code source, le wikicode[q].",French
"[3] Later streefde Herbert George Wells naar een World Brain,[4] een samenvatting van alle kennis op microfilm.",Dutch
"Klockan 20:52 skapades den första artikeln, WikiPedia, av samma användare.",Swedish
"remark and say that this is an atrocious act smart word number 5 is stupendous, stupendous, stupendous, means amazing astonishing.",English
vielen Dank für Ihre Mühen.,German
Cette conception française de la culture serait plutôt individualiste.,French
Onestamente non credo che funzionerà.,Italian
don't take it to heart like seriously don't be so upset don't take it to heart.,English
"Wikipedia organise une collecte de fonds annuelle, annoncée par des bandeaux présents sur chaque page sous forme d'« appels » de Jimmy Wales ou de divers contributeurs.",French
Hvordan har du det?,Danish
oye cálmate juntos otra frase que.,Spanish
"então, da próxima vez que você ouvir falar de um ato horrível no noticiário, lembre-se disso.",Portuguese
"El proyecto tuvo el apoyo económico de la empresa Bomis, fundada por Wales y administrada por este junto con un compañero desde 1996,[36]​ y la colaboración de Richard Stallman, quien propuso el cambio a la licencia pública general de GNU, desde la antigua Nupedia Open Content License.",Spanish
"En 2019, l'espèce Viola wikipedia est nommée en l'honneur de l'encyclopédie[163].",French
dedos cruzados.,Portuguese
"Al día de hoy, en la edición en español hay registrados 6 103 100 usuarios, de los cuales menos del 0,3 % son usuarios activos —usuarios que han realizado al menos una acción en los últimos 30 días—.",Spanish
"gracias de antemano, lo que significa que realmente espero que lo hagas.",Spanish
[103] 60% dos usuários registrados nunca fazem outra edição após as suas primeiras 24 horas.,Portuguese
"For this reason the most fundamental science is generally understood to be ""physics""—the name for which is still recognizable as meaning that it is the ""study of nature"".",English
"Es ist zu viel auf meinem Teller, ich ertrinke in der Arbeit.",German
wacht even.,Dutch
Was geht?,German
[307] The encyclopedia's assertions are increasingly used as a source by organizations such as the US federal courts and the World Intellectual Property Organization[308]—though mainly for supporting information rather than information decisive to a case.,English
erano esseri magici qualcosa di cui la madre di Narcisse non sapeva nulla di Terry Melli oh è così bello vederti è passato molto tempo non come sei stato io sono stato molto bravo sarei stato meglio se solo se solo e se solo mia figlia narcisa fosse stata un po 'più comprensiva marian ha detto a mellie e terry tutto su narcisa e come era preoccupata per lei vuole mangiare pane d'oro cosa ci faccio bene con lei forse se il suo sogno si avvera.,Italian
ber någon vänta.,Swedish
"Obter o conteúdo completo da Wikipédia para reutilização apresenta desafios, uma vez que a cópia direta através de um web crawler é desencorajada.",Portuguese
Perdi meu telefone e estou em apuros ou nosso ônibus quebrou esta manhã e eu estou em apuros Meu amigo sempre pede ajuda quando está em apuros e quando as coisas estão boas ele se esquece.,Portuguese
my pleasure.,English
"Veel leerproblemen zijn NP-hard of moeilijker, dus een belangrijk onderdeel van dit vakgebied is algoritmes te ontwikkelen die de oplossing benaderen.",Dutch
"Por ejemplo, Microsoft eliminó un párrafo donde aparecían los errores de su consola Xbox 360, y el consorcio petrolífero Chevron-Texaco borró todo un texto sobre biodiésel.",Spanish
"William G. Emigh e Susan C. Herring (2005) affermano che «pochi utenti attivi, quando agiscono in concerto con norme stabilite all'interno di un sistema redazionale aperto, possono raggiungere il controllo totale sul contenuto prodotto nel sistema, cancellando letteralmente diversità, controversie e inconsistenze, e omogeneizzando le voci dei collaboratori.»[38] I redattori di Wikinfo, un progetto derivato da Wikipedia, sostengono analogamente che i contributori nuovi o controversi di Wikipedia sono spesso ingiustamente etichettati troll o utenti problematici e viene loro impedito di apportare modifiche.",Italian
Le fait que le même mot sauvage soit utilisé d'une part comme un synonyme de naturel et d'autre part pour qualifier des actes particulièrement violents ou cruels (même s'ils sont commis dans des sociétés urbaines avec des moyens techniques sophistiqués) met bien en évidence une certaine tradition idéologique qui place plus ou moins consciemment du côté de la nature ce qui est étranger à la culture dominante et/ou mauvais.,French
"Condensing water vapor, most or all of which came from ice delivered by comets, produced the oceans and other water sources.",English
Hay controversia sobre su fiabilidad y precisión.,Spanish
Höre also wirklich auf die Intonation.,German
"[144] A partir de janeiro de 2002 (segunda fase), a Wikipédia passou a contar com um software escrito em PHP wiki, por meio de um banco de dados MySQL, feito sob medida para a Wikipédia por Magnus Manske.",Portuguese
"as far as i'm concerned, this is the best restaurant in town.",English
Jeg kunne ikke være mere enig.,Danish
"Edições em artigos especificados são agora ""sujeitas a revisão de um editor estabelecido da Wikipédia antes da publicação.""",Portuguese
et tu es comme oh ça l'explique qui l'explique.,French
en cualquier momento.,Spanish
